track_id,main_artist_id,released_date,loudness,tempo,tempo_confidence,time_signature,time_signature_confidence,track_name,track_popularity,other_artists,track_image_url,lyrics,main_artist_name,main_artist_popularity,main_artist_genre,main_artist_image_url
2bLqfJjuC5syrsgDsZfGmn,5Y5TRrQiqgUO4S36tzjIRZ,2007-01-01,-6.492,114.742,0.833,4.0,1.0,The Way I Are,85,"Keri Hilson, D.O.E.",https://i.scdn.co/image/ab67616d0000b2734ed674ab91bdc566534f9285,"[Intro: Timbaland]<br>State of emergency<br>Yeah, yeah (Yeah)<br>Yeah, yeah (Yeah)<br>Remember the time, baby<br>Yeah, yeah (Yeah)<br><br>[Verse 1: Timbaland]<br>I ain't got no money<br>I ain't got no car to take you on a date<br>I can't even buy you flowers<br>But together we can be the perfect soulmates<br>Talk to me, girl<br><br>[Pre-Chorus: Keri Hilson]<br>(Oh) Baby, it's alright now, you ain't gotta flaunt for me<br>If we go Dutch, you can still touch my love, it's free<br>We can work without the perks, just you and me<br>Thug it out 'til we get it right<br><br>[Chorus: Keri Hilson, Timbaland, Both]<br>Baby, if you strip, you can get a tip<br>'Cause I like you just the way you are<br>I'm about to strip and I'm well-equipped<br>Can you handle me the way I'm are?<br>I don't need the G's or the car keys<br>Boy, I like you just the way you are<br>Let me see ya strip, you can get a tip<br>'Cause I like, I like, I like<br>You might also like[Verse 2: Timbaland]<br>I ain't got no Visa<br>I ain't got no Red American Express<br>We can't go nowhere exotic<br>It don't matter 'cause I'm the one that loves you best<br>Talk to me, girl<br><br>[Pre-Chorus: Keri Hilson]<br>(Oh) Baby, it's alright now, you ain't gotta flaunt for me<br>If we go Dutch, you can still touch my love, it's free<br>We can work without the perks, just you and me<br>Thug it out 'til we get it right<br><br>[Chorus: Keri Hilson, Timbaland, Both]<br>Baby, if you strip, you can get a tip<br>'Cause I like you just the way you are<br>I'm about to strip and I'm well-equipped<br>Can you handle me the way I'm are?<br>I don't need the G's or the car keys<br>Boy, I like you just the way you are<br>Let me see ya strip, you can get a tip<br>'Cause I like you just the way you are<br><br>[Verse 3: John Doe/D.O.E.]<br>Yeah, baby girl<br>I don't got a huge ol' house, I rent a room in a house<br>Listen baby girl<br>I ain't got a motorboat, but I can float ya boat<br>So listen baby girl<br>Once you get a dose of D.O.E., you gon' want some mo'<br>So listen baby girl<br>When I make it, I want you there, want you there, yeah19",Timbaland,76,"dance pop, pop, pop rap",https://i.scdn.co/image/ab6761610000e5eb2ec030557b0529c01639529b
0WH65R3DLtFPh8KN2b1mzI,6lh7vDO9GPAbyQ7PhT2a80,2023-03-17,-5.712,119.97,0.746,4.0,1.0,LA RUCHE,45,"Realo, So La Lune",https://i.scdn.co/image/ab67616d0000b273805ae6e215ce80d74f51329b,"[Paroles de ""LA RUCHE"" ft. Realo & So La Lune]<br><br>[Couplet 1 : winnterzuko]<br>Difficile de pas s'faire un film, on fait du cash, c'est une relation intime<br>Qui s'rappelle quand j'étais super triste ? J'avais les joues humides, j'avais pas un dream<br>J'me rappelle, j'avais même pas un euro, j'disais : ""Viens, on l'fait tant qu'c'est pas un crime""<br>Ils m'voient comme un bouffon tant qu'j'suis pas un king, j'ai bougé bien avant qu'il n'y ait un signe<br>J'connais que la misère, moi, j'vais pas rapper la rue<br>Ouvre les yeu-z, regarde à dix heures, ils veulent s'approcher d'la ruche<br>Maman, elle est femme de ménage et papa, j'sais pas il est où<br>Tant qu'le bonheur n'est pas rentré, j'sors pour aller faire des ous-s<br><br>[Refrain : Realo]<br>Oh-Oh my fucking money<br>Give my fucking money<br>Oh-Oh my fucking money<br>Give my fucking money<br>Oh-Oh my fucking money<br>Give my fucking money<br>Oh-Oh my fucking money<br>Give my fucking money<br><br>[Couplet 2 : So La Lune]<br>J'pourrais tout faire<br>Aussi loin qu'j'me souviens, j'pourrais visser même à Surgères<br>J'faisais d'jà cette merde en sixième<br>Tout s'fait, quand c'est le diable qui survient<br>Tu m'as vu dans l'ombre, tu t'souviens ?<br>Elle a dit quoi Rihanna ? Oh, oh<br>J'ai introduit son système, c'est le roman d'une vie qui n'a pas commencé<br>2Pac, Zizou, Molière, les romans, je fuis c'qui n'a pas commencé<br>Gros, t'es pas dans ma tête, tu sais pas comment c'est<br>J'ai mis l'alcool dosé, ils peuvent tout condenser<br>J'ai vu cinquante royaumes, des mots non-prononcés<br>You might also like[Pont : Realo]<br>Et on fly<br>J'suis dans mon world et j'fly<br>Regarde-moi<br><br>[Refrain : Realo]<br>Oh-Oh my fucking money<br>Give my fucking money<br>Oh-Oh my fucking money<br>Give my fucking money<br>Oh-Oh my fucking money<br>Give my fucking money<br>Oh-Oh my fucking money<br>Give my fucking money",winnterzuko,48,hyperpop francais,https://i.scdn.co/image/ab6761610000e5eb5db172a72ce98eec65229367
0z3YYobsavHguLTgqg5GC1,78rUTD7y6Cy67W1RVzYs7t,2022-08-10,-6.506,128.519,0.68,4.0,0.869,Picture in My Mind,64,Sam Gellaitry,https://i.scdn.co/image/ab67616d0000b273897de13d496e00c2d72f8ee1,"[Verse 1: PinkPantheress]<br>Always noticed something 'bout you<br>So similar to me, it scares me<br>I'm impatient, I can't wait to see<br>What it is that brought you to be<br>Identical to me, it's frightening<br>So, why are we together?<br><br>[Pre-Chorus: PinkPantheress]<br>Now when we sometimes do disagree, I like it<br>It's a sign you don't think like me, that's fine<br>But sometimes feel some way when you choose to leave<br>And sometimes, I just can't stand to be with you, that's why<br><br>[Chorus: PinkPantheress, PinkPantheress & Sam Gellaitry]<br>Thought I knew this all along<br>I had a picture in my mind<br>So please don't try and call my bluff<br>I don't think we can try to fight it<br>So, why are we together?<br>I knew this all along<br>I had a picture in my mind<br>So please don't try and call my bluff<br><br>[Post-Chorus: Sam Gellaitry]<br>We've put both of our hearts on the line<br>Take what's yours and, darling, I'll take mine<br>Headfirst inside the deepest dive<br>I've been waiting for you my whole life<br>You might also like[Verse 2: PinkPantheress]<br>And when you see me, you walk the other way<br>I guess it's easy to say you never saw me that day<br>And with my intent about you, why can't we make amends?<br>I'll never see you again, I think you're more of a friend<br><br>[Pre-Chorus: PinkPantheress]<br>Now when we sometimes do disagree, I like it<br>It's a sign you don't think like me, that's fine<br>Sometimes feel some way when you choose to leave<br>Sometimes, I just can't stand to be with you, that's why<br><br>[Chorus: PinkPantheress, PinkPantheress & Sam Gellaitry]<br>Thought I knew this all along<br>I had a picture in my mind<br>So please don't try and call my bluff<br>I don't think I can try to fight it<br>So, why are we together?<br>Thought I knew this all along<br>I had a picture in my mind<br>So please don't try and call my bluff<br><br>[Post-Chorus: Sam Gellaitry]<br>We've put both of our hearts on the line<br>Take what's yours and, darling, I'll take mine<br>Headfirst inside the deepest dive<br>I've been waiting for you my whole life<br>[Outro: PinkPantheress & Sam Gellaitry, Sam Gellaitry]<br>I knew this all along<br>I had a picture in my mind<br>So please don't try and call my bluff<br>We've put both of our hearts on the line<br>Take what's yours and, darling, I'll take mine<br>Headfirst inside the deepest dive<br>I've been waiting for you my whole life8",PinkPantheress,75,bedroom pop,https://i.scdn.co/image/ab6761610000e5eb90ddbcd825c7b6142d269e26
26AmP3ukYC4Zs9lSGlh55I,78rUTD7y6Cy67W1RVzYs7t,2022-12-16,-8.304,172.072,0.616,4.0,0.826,Take Me Home,64,,https://i.scdn.co/image/ab67616d0000b27378c582c67f2104448ec471ab,"[Intro]<br>Hello?<br><br>[Verse 1]<br>I'm making the most of my life<br>Till the day that I hit twenty-five<br>I know that they'll make an adult of me<br>I know that I'm not quite ready to be<br><br>[Pre-Chorus]<br>And I know I've got some growing, I realised the other day<br>When I said some things that I knew that I shouldn't say<br>I opened up a letter of bills that I didn't pay<br>They were due in April, but now it's the end of May<br><br>[Chorus]<br>It's sad that I<br>Prepare to be so young till the end of time<br>I realised<br>When I struggled to get out of my room last night<br>Got on my phonе<br>And I begged for my brother to takе me home<br>When he asked why<br>I said I'd rather be here alone<br><br>[Verse 2]<br>I went to the doctor again<br>Said I was behind on my rent<br>He told me it's not a problem for him<br>I said that you're so good at listening<br>You might also like[Pre-Chorus]<br>And I know I've got some growing, I realised the other day<br>When I said some things that I knew that I shouldn't say<br>I opened up a letter of bills that I didn't pay<br>They were due in April, but now it's the end of May<br><br>[Chorus]<br>It's sad that I<br>Prepare to be so young till the end of time<br>I realised<br>When I struggled to get out of my room last night<br>Got on my phone<br>And I begged for my brother to take me home<br>When he asked why<br>I said I'd rather be here alone<br>(Hello?)<br>It's sad that I<br>Prepare to be so young till the end of time<br>I realised<br>When I struggled to get out of my room last night<br>Got on my phone<br>And I begged for my brother to take me home<br>When he asked why<br>I said I'd rather be here alone5",PinkPantheress,75,bedroom pop,https://i.scdn.co/image/ab6761610000e5eb90ddbcd825c7b6142d269e26
3NanY0K4okhIQzL33U5Ad8,78rUTD7y6Cy67W1RVzYs7t,2022-11-30,-8.407,132.981,0.542,4.0,1.0,Boy's a Liar,75,,https://i.scdn.co/image/ab67616d0000b2735911dc1602a9d100ebe955fc,"[Verse 1]<br>Take a look inside your heart, is there any room for me?<br>I won't have to hold my breath till you get down on one knee<br>Because you only want to hold me when I'm looking good enough<br>Did you ever feel me? Would you ever picture us?<br>Every time I pull my hair, well, it's only out of fear<br>That you'll find me ugly and one day you'll disappear because<br><br>[Pre-Chorus]<br>What's the point of crying? It was never even love<br>Did you ever want me? Was I ever good enough?<br><br>[Chorus]<br>Thе, the boy's a liar, the boy's a liar<br>He doеsn't see ya, you're not looking at me, boy<br>The boy's a liar, the boy's a liar<br>He doesn't see ya, you're not looking at me, boy<br><br>[Post-Chorus]<br>Good eno-o-ough, good eno-o-ough<br>Good eno-o-ough, good eno-o-ough<br>Good eno-o-ough, good eno-o-ough<br>Good eno-o-ough, good eno-o-ough<br><br>[Verse 2]<br>Baby, please, I just want to look nice for you<br>Come stay with me<br>Oh, you're not around, so what should I do?<br>I thought you liked the look about a girl just like me<br>Baby, please, I know you want to change me<br>Can you take a look inside your heart, is there any room for me?<br>I won't have to hold my breath till you get down on one knee because<br>You might also like[Pre-Chorus]<br>What's the point of crying? It was never even love<br>Did you ever want me? Was I ever good enough?<br><br>[Chorus]<br>The, the boy's a liar, the boy's a liar<br>He doesn't see ya, you're not looking at me, boy<br>The boy's a liar, the boy's a liar<br>He doesn't see ya, you're not looking at me, boy<br><br>[Post-Chorus]<br>Good eno-o-ough, good eno-o-ough<br>Good eno-o-ough, good eno-o-ough<br>Good eno-o-ough, good eno-o-ough<br>Good eno-o-ough, good eno-o-ough27",PinkPantheress,75,bedroom pop,https://i.scdn.co/image/ab6761610000e5eb90ddbcd825c7b6142d269e26
4bqDgEc3V9o0gle8mvgCgN,78rUTD7y6Cy67W1RVzYs7t,2023-10-12,-7.965,140.005,0.729,4.0,0.936,Capable of love,72,,https://i.scdn.co/image/ab67616d0000b27356c3901b6138401562e1bfb4,"[Verse 1]<br>So we have a day prepared<br>It's in your writin', don't forget<br>I know last time you had doubts, oh, you said<br>That you couldn't make it, ""Let's do later instead""<br>Right now I think you're the cause of my grief<br>And I haven't slept well for a week<br>You are somebody that I want to keep<br>But you said it's not deep and to that answer I weep<br><br>[Instrumental Break]<br><br>[Verse 2]<br>It's weird how people still think it's pretend<br>The bond between us doesn't end<br>But they don't know the long distance we went<br>The one that we'll put behind us<br>Now that we're more than friends<br>I always wondеred if we passed on a street<br>And I'd still nеver asked you yet to meet<br>But there's no other place I'd want to be<br>Than sat here replyin' to someone on a screen<br><br>[Chorus]<br>And I think I need a picture 'cause it's never enough<br>To see you smilin' in my mind when I lay still in the dark<br>It starts with you<br>Starts with you<br>I'm obsessed with the idea that one day it breaks up<br>'Cause after that, I know I'll never be as capable of love<br>After you<br>After you<br>You might also like[Bridge]<br>Three little words, dedicate them to me<br>Please make them personal, then say them to me<br>My focus is everywhere, I'm not listenin'<br>I got a readin' on my palm just to see<br>Don't you feel everything you're supposed to?<br>(Three little words, dedicate them to me)<br>(Please make them personal then say them to me)<br>I'm wastin' away, I feel psycho<br>I got a confession, I'm never givin' up<br>(My focus is everywhere, I'm not listenin')<br>I just need to know if you're capable of love<br>(I got a readin' on my palm just to see)<br><br>[Chorus]<br>And I think I need a picture 'cause it's never enough<br>To see you smilin' in my mind when I lay still in the dark<br>It starts with you<br>Starts with you<br>I'm obsessed with the idea that one day it breaks up<br>'Cause after that, I know I'll never be as capable of love<br>After you<br>After you<br><br>[Outro]<br>Three little words, dedicate them to me<br>Please make them personal, then say them to me<br>My focus is everywhere, I'm not listenin'<br>I got a readin' on my palm just to see<br>Three little words, dedicate them to me<br>Please make them personal, then say them to me<br>My focus is everywhere, I'm not listenin'<br>I got a readin' on my palm just to see<br>Three little words, dedicate them to me<br>Please make them personal, then say them to me<br>My focus is everywhere, I'm not listenin'<br>I got a readin' on my palm just to see<br>Three little words, dedicate them to me<br>Please make them personal, then say them to me<br>My focus is everywhere, I'm not listenin'<br>I got a readin' on my palm just to see8",PinkPantheress,75,bedroom pop,https://i.scdn.co/image/ab6761610000e5eb90ddbcd825c7b6142d269e26
4fPjI40ElIwJQ4DJJxSCOe,78rUTD7y6Cy67W1RVzYs7t,2021-07-09,-11.094,114.21,0.694,4.0,1.0,Attracted to You,75,,https://i.scdn.co/image/ab67616d0000b2734b92001006e5ad1946e86a84,"[Verse]<br>I-I-I thought I found the answer to it (To it)<br>Eternal happiness tonight (Hey)<br>But it was just another blip in my heart<br>Sometimes I think of calling you up<br>To make myself look bad again<br>But now I'm bringing flowers to your front door<br>Last night I had a dream, we started dating now you're pissing me off<br>I know it's not l-l-love (Yeah)<br>It's not something I want<br>I'm not attracted to you, like I was<br>Back at the start (Back at the start)<br>Back at the start<br><br>[Outro]<br>You're in my head, so I can't now forget you<br>You're in my head, so I can't, so I can't now<br>You're in my head, so I can't now forget you<br>You're in my head, so I can't now forget youYou might also like4",PinkPantheress,75,bedroom pop,https://i.scdn.co/image/ab6761610000e5eb90ddbcd825c7b6142d269e26
4icnlpI5IbZcRO9mpixVVW,78rUTD7y6Cy67W1RVzYs7t,2022-04-22,-4.786,134.994,0.668,4.0,1.0,Where You Are,61,WILLOW,https://i.scdn.co/image/ab67616d0000b273e9c343b9ef0c44c947036f93,"[Verse 1: PinkPantheress]<br>I suffer in silence, I still don't know why I guess<br>I'm built for another (Another)<br>A flower I'm growing wilted today, I chose it<br>To leave you tonight, you don't want it, do you? (Do you, do you, do you)<br><br>[Pre-Chorus: PinkPantheress, WILLOW]<br>Oh-oh, oh<br>I don't know what to do<br>I wish that I'd never met you, no oh<br>(I know this feeling well, I wish I could tell)<br><br>[Bridge: PinkPantheress]<br>This last year I've been through<br>Several feelings that you didn't once let me choose<br>(You turned on me)<br>I now look back when we yelled, it's reminiscent<br>I held the hope to find someone else<br><br>[Chorus: PinkPantheress, WILLOW]<br>So please tell mе where you are<br>Now my lifе's a downward spiral, got my broken heart recycle<br>Please tell me where you are<br>I've lost sight of what to do, don't spend one day in my shoes, now<br>Tell me where you are (Oh, oh, oh)<br>You tell me it will be okay, but I know we will never be the same (This feeling)<br>I know that I could work with maybe's<br>Please tell me that you want to meet again<br>You might also like[Verse 2: WILLOW]<br>Never thought I'd wanna just jump right out my head<br>Never really thought I'd ever question what you said<br>In my bed, in my room, I can't forget<br>So many hopes, so many dreams<br>No, it isn't what it fuckin' seems (Yeah)<br><br>[Pre-Chorus: WILLOW, PinkPantheress & WILLOW]<br>I don't know what to do<br>I wish that I'd never met you, no oh<br>I don't know what to do<br>I wish that I'd never met you, no oh<br><br>[Chorus: PinkPantheress, WILLOW]<br>So please tell me where you are<br>Now my life's a downward spiral, got my broken heart recycle<br>Please tell me where you are<br>I've lost sight of what to do, don't spend one day in my shoes, now<br>Tell me where you are (Oh, oh, oh)<br>You tell me it will be okay, but I know we will never be the same (This feeling)<br>I know that I could work with maybe's<br>Please tell me that you want to meet again11",PinkPantheress,75,bedroom pop,https://i.scdn.co/image/ab6761610000e5eb90ddbcd825c7b6142d269e26
67r7ZHxVxONN9ZQk05AQVL,78rUTD7y6Cy67W1RVzYs7t,2022-11-15,-7.144,129.928,0.366,4.0,1.0,Do You Miss Me?,61,,https://i.scdn.co/image/ab67616d0000b273f9c9812c775bdb0e9c70d5f1,"[Verse 1]<br>Ha, ah, yeah<br>I can't let go of your hand<br>I can't even breathe without you<br>I don't think you understand<br>Ha, ah, yeah<br>I love to watch you as you speak<br>And you say the words ""I love you""<br>Tell me, when you fall asleep<br><br>[Chorus]<br>Do you miss me? Miss me, ah<br>Miss me, miss me, yeah<br>Miss me, miss me, ah<br>Miss me, miss me, ah<br>Miss me, miss me, ah<br>Miss me, miss me, ah<br>Miss me, miss me, ah<br>Miss me, miss me, ah<br><br>[Verse 2]<br>Ha, ah, yeah<br>We don't even get in fights<br>Went downstairs to make a coffee<br>In the morning how you like<br>Ha, ah, yeah<br>All I wantеd was to scream<br>When I saw one of hеr messages that popped up on your screen<br>You might also like[Bridge]<br>Do you miss me? Miss me, ah<br>Does she miss you, too?<br>I can be discreet if you don't want her seeing you<br>With me on your arm (Yeah)<br>'Cause I know you can't tell her yet<br>Practice my ""I dos"" when I'm home 'cause I know I still want you<br><br>[Chorus]<br>Do you miss me? Miss me, ah<br>Miss me, miss me, ah<br>Miss me, miss me, ah<br>Miss me, miss me, ah<br>Miss me, miss me, ah<br>Miss me, miss me, ah<br>Miss me, miss me, ah<br>Miss me, miss me, ah<br><br>[Outro]<br>(Miss me, miss me, ah)2",PinkPantheress,75,bedroom pop,https://i.scdn.co/image/ab6761610000e5eb90ddbcd825c7b6142d269e26
6AQbmUe0Qwf5PZnt4HmTXv,78rUTD7y6Cy67W1RVzYs7t,2023-02-03,-8.254,132.962,0.469,4.0,1.0,Boy's a Liar Pt 2,89,Ice Spice,https://i.scdn.co/image/ab67616d0000b27342c5ba689b2e7cbc208a8fa7,"[Verse 1: PinkPantheress]<br>Take a look inside your heart<br>Is there any room for me (Is there any room for me?)<br>I won't have to hold my breath<br>Till you get down on one knee (Till you get down on one knee)<br>Because you only want to hold me<br>When I'm looking good enough (When I'm looking good enough)<br>Did you ever feel me?<br>Would you ever picture us? (Would you ever picture us?)<br><br>[Verse 2: PinkPantheress]<br>Every time I pull my hair<br>Well, it's only out of fear (Only out of fear)<br>That you'll find me ugly<br>And one day you'll disappear because<br>What's the point of crying?<br>It was nеver even lovе (It was never even love)<br>Did you ever want me?<br>Was I ever good enough? (Ever good enough?)<br><br>[Chorus: PinkPantheress]<br>The-the boy's a liar, the boy's a liar<br>He doesn't see ya, you're not looking at me, boy<br>The boy's a liar, the boy's a liar<br>He doesn't see ya, you're not looking at me, boy<br>You might also like[Post-Chorus: PinkPantheress]<br>Good eno-o-ough, good eno-o-ough<br>Good eno-o-ough, good eno-o-ough<br>Good eno-o-ough, good eno-o-ough<br>Good eno-o-ough, good eno-o-ough<br><br>[Verse 3: Ice Spice]<br>He say that I'm good enough, grabbin' my duh-duh-duh<br>Thinkin' 'bout shit that I shouldn't've (Huh)<br>So I tell him there's one of me, he makin' fun of me (Ha-ha)<br>His girl is a bum to me (Grrah)<br>Like that boy is a cap<br>Sayin' he home, but I know where he at, like<br>Bet he blowin' her back<br>Thinkin' 'bout me 'cause he know that it's fat (Damn)<br>And it been what it been (Huh)<br>Callin' his phone like, ""Yo, send me a pin""<br>Duckin' my shit, 'cause he know what I'm on (Grrah)<br>But when he hit me I'm not gon' respond (Grrah)<br>But I don't sleep enough without you<br>And I can't eat enough without you (Huh)<br>If you don't speak, does that mean we're through? (Huh)<br>Don't like sneaky shit that you do (Grrah)<br><br>[Chorus: PinkPantheress]<br>The-the boy's a liar, the boy's a liar<br>He doesn't see ya, you're not looking at me, boy<br>The boy's a liar, the boy's a liar<br>He doesn't see ya, you're not looking at me, boy<br>[Post-Chorus: PinkPantheress]<br>Good eno-o-ough, good eno-o-ough<br>Good eno-o-ough, good eno-o-ough<br>Good eno-o-ough, good eno-o-ough<br>Good eno-o-ough, good eno-o-ough24",PinkPantheress,75,bedroom pop,https://i.scdn.co/image/ab6761610000e5eb90ddbcd825c7b6142d269e26
14ROF9YTXbKAyXActHFyaH,7vcsHACKyahyVI85epvcnt,2021-02-05,-8.33,130.039,0.58,4.0,1.0,RE-45,26,Wit.,https://i.scdn.co/image/ab67616d0000b273b1a877b97c0f81712660e3a7,"[Paroles de ""RE-45""]<br><br>[Intro : Wit.]<br>Yeah, yeah, yeah, yeah<br><br>[Refrain : Wit.]<br>Y'avait tant d'espoir au début d'l'histoire<br>Mais laisse tomber ça, mais laisse tomber ça<br>D'vant les portes de l'enfer, tout est noir, on l'sait<br>Khey, à quoi bon briller ? Y'a plus d'étoiles dans le ciel<br>Nan, nan, viens pas par ici, c'est chaud<br>J'pourrais pas t'expliquer toutes ces choses<br>T’aurais pas dû écouter tous ces gens<br>J'y croyais, toi, tu doutais, yeah<br><br>[Couplet 1 : Wit.]<br>En vrai, j'en n'ai plus rien à chier, eh, dis-moi combien manquent à l'appel<br>Y'a des hommes qui s'achètent, faut croirе, j'm'en vais, j'dis ""salem"" à la Terrе, faut croire<br>Y'a beaucoup de fumée dans la pièce, on connait pas la délicatesse<br>Tu m'verras jamais les enlacer car le cœur est tombé sur la tête<br>Khey, j'suis dans un piège, j'sais pas comment m'en sortir<br>Des fois, j'y crois plus trop mais la vengeance me motive<br>C'est beau quand tu parles de paix, ça fait des éclaircies, vraiment<br>C'est beau quand tu parles de paix mais là dehors, ça tire, yeah<br>J'aimerais bien trouver la faille, celui que j'cherchais, yeah, yeah<br>Le bonheur est dans les flammes à c't'heure-ci, yeah, yeah<br>Chérie, on s'arrête, on fait l'nécessaire, yeah, yeah<br>Tu m'as promis mais j'sais pas si t’es sincère, yeah, yeah<br>You might also like[Refrain : Wit.]<br>Y'avait tant d'espoir au début d'l'histoire<br>Mais laisse tomber ça, mais laisse tomber ça<br>D'vant les portes de l'enfer, tout est noir, on l'sait<br>Khey, à quoi bon briller ? Y'a plus d'étoiles dans le ciel<br>Nan, nan, viens pas par ici, c'est chaud<br>J'pourrais pas t'expliquer toutes ces choses<br>T’aurais pas dû écouter tous ces gens<br>J'y croyais, toi, tu doutais, yeah<br><br>[Couplet 2 : Wit.]<br>J'étais solo dans la tempête, bien capuché sous la parka<br>Je souris mais ne t'emballe pas, t'étais où quand j't'ai dit ""pars pas""<br>Si j'mets les deux pieds au sommet, p't-être que j'me sentirais à ma place<br>Pourront pas nier à chaque fois<br>Khey, j'suis dans un piège, j'sais pas comment m'en sortir<br>Des fois j'y crois plus trop mais la vengeance me motive<br>C'est beau quand tu parles de paix, ça fait des éclaircies, vraiment<br>C'est beau quand tu parles de paix mais là dehors, ça tire<br>Me demande pas si ça va, j'sais pas<br>C'est moi contre eux mais j'trouve ça équitable<br>Plus j'avance, plus l'couloir est étroit<br>J'te transfère ma haine en MP3<br><br>[Outro : Wit.]<br>Y'avait tant d'espoir au début d'l'histoire<br>Mais laisse tomber ça, mais laisse tomber ça<br>D'vant les portes de l'enfer, tout est noir, on l'sait<br>Khey, à quoi bon briller ? Y'a plus d'étoiles dans le ciel<br>Nan, nan, viens pas par ici, c'est chaud<br>J'pourrais pas t'expliquer toutes ces choses<br>T’aurais pas dû écouter tous ces gens<br>J'y croyais, toi, tu doutais, yeah",Dioscures,27,rap francais nouvelle vague,https://i.scdn.co/image/ab6761610000e5ebcc6434e6f018580fd6fef0a6
