track_id,main_artist_id,released_date,loudness,tempo,tempo_confidence,time_signature,time_signature_confidence,track_name,track_popularity,other_artists,track_image_url,lyrics,main_artist_name,main_artist_popularity,main_artist_genre,main_artist_image_url
2gam98EZKrF9XuOkU13ApN,2jw70GZXlAI8QzWeY2bgRc,2006-01-01,-6.098,114.328,0.829,4.0,1.0,Promiscuous,87,Timbaland,https://i.scdn.co/image/ab67616d0000b273a6f439c8957170652f9410e2,"[Intro: Nelly Furtado, Timbaland]<br>Am I throwin' you off?<br>Nope<br>Didn't think so<br><br>[Verse 1: Nelly Furtado & Timbaland]<br>How you doin', young lady?<br>That feelin' that you're givin' really drives me crazy<br>You're dope, have a player 'bout to choke<br>I was at a loss for words first time that we spoke<br>You lookin' for a girl that'll treat you right?<br>How you lookin' for her in the daytime with the light?<br>You might be the type if I play my cards right<br>I'll find out by the end of the night<br>You expect me to just let you hit it?<br>But will you still respect me if you get it?<br>All I can do is try, gimme one chance (Chance)<br>What's the problem? I don't see no ring on your hand (Hand)<br>I'll be the first to admit it<br>I'm curious about you, you seem so innocent<br>You wanna get in my world, get lost in it?<br>Boy, I'm tired of runnin', let's walk for a minute<br><br>[Chorus 1: Nelly Furtado & Timbaland]<br>Promiscuous girl, wherever you are<br>I'm all alone, and it's you that I want<br>Promiscuous boy, you already know<br>That I'm all yours, what you waitin' for?<br>Promiscuous girl, you're teasin' me<br>You know what I want, and I got what you need<br>Promiscuous boy, let's get to the point<br>'Cause we're on a roll, you ready?<br>You might also like[Verse 2: Nelly Furtado & Timbaland]<br>Roses are red, some diamonds are blue<br>Chivalry is dead, but you're still kinda cute<br>Hey, I can't keep my mind off you<br>Where you at? Do you mind if I come through?<br>I'm out of this world, come with me to my planet<br>Get you on my level, do you think that you can handle it?<br>They call me Thomas, last name Crown<br>Recognize game, I'ma lay mine's down<br>I'm a big girl, I can handle myself<br>But if I get lonely, I'ma need your help<br>Pay attention to me, I don't talk for my health<br>I want you on my team -- So does everybody else<br>Shh, baby, we can keep it on the low (Low)<br>Let your guard down, ain't nobody gotta know (Know)<br>If you with it, girl, I know a place we can go<br>What kind of girl do you take me for?<br><br>[Chorus 1: Nelly Furtado & Timbaland]<br>Promiscuous girl, wherever you are<br>I'm all alone, and it's you that I want<br>Promiscuous boy, you already know<br>That I'm all yours, what you waitin' for?<br>Promiscuous girl, you're teasin' me<br>You know what I want, and I got what you need<br>Promiscuous boy, let's get to the point<br>'Cause we're on a roll, you ready?<br>[Bridge: Timbaland & Nelly Furtado]<br>Don't be mad, don't get mean<br>Don't get mad, don't be mean<br>Hey, don't be mad, don't get mean<br>Don't get mad, don't be mean<br><br>[Verse 3: Nelly Furtado & Timbaland]<br>Wait, I don't mean no harm<br>I can see you with my t-shirt on<br>I can see you with nothin' on<br>Feelin' on me before you bring that on<br>Bring that on?! -- You know what I mean<br>Girl, I'm a freak, you shouldn't say those things<br>I'm only tryna get inside of your brain<br>To see if you can work me the way you say<br>It's okay, it's alright<br>I got something that you gon' like<br>Hey, is that the truth or are you talkin' trash?<br>Is your game M.V.P like Steve Nash?<br><br>[Chorus 2: Nelly Furtado & Timbaland]<br>Promiscuous girl, wherever you are<br>I'm all alone, and it's you that I want<br>Promiscuous boy, I'm callin' your name<br>But you're drivin' me crazy the way you're makin' me wait<br>Promiscuous girl, you're teasin' me<br>You know what I want, and I got what you need<br>Promiscuous boy, we're one and the same<br>So we don't gotta play games no more<br>[Outro: Nelly Furtado]<br>Eh-eh, eh-eh, ah-ah-ah<br>Eh-eh, eh-eh, ah-ah-ah<br>Eh-eh, eh-eh, ah-ah-ah<br>Eh-eh, eh-eh, ah-ah-ah<br>Mm, mm, mm, mm<br>Mm, mm, ah-ah-ah<br>Eh-eh, eh-eh, ah-ah-ah<br>Eh-eh, eh-eh, ah-ah-ah56",Nelly Furtado,75,"canadian latin, canadian pop, dance pop, pop",https://i.scdn.co/image/ab6761610000e5eb4cf746b3348b3b0111056c11
2H5bVnyhhffT7pKFvY04TB,7HO5fOXE4gh3lzZn64tX2E,2023-10-27,-7.428,99.959,0.031,5.0,0.854,Ride,55,Young Thug,https://i.scdn.co/image/ab67616d0000b273b71813659cbbbd04cabf831c,"[Intro: Young Thug]<br>(AJ Stay Workin, on God)<br>This the right tune?<br>Okay<br><br>[Verse 1: Young Thug]<br>If you told them you love me, then just say it again, yeah<br>You said you trust me, need to show me then<br>I'm trying to cut back, bae, I'm always spending<br>I'm tryning to be serious, but I always grin<br>She said she fell in love, it was 'bout that time to see<br>Okay, I drip love, think you need an IV<br>I've been living higher, because they was tryna get us<br>Every day is Christmas, yeah, yeah-yeah<br>We ain't the same, we ain't the same, nah<br>Peep the range, it's ten feet tall<br>I'm rocking white I've been matching her Off-Whitе walls<br>While I wipe off, the maid changеd the sheets, oh<br>I keep a bad one, and she keep my meat tall<br>I keep a bad one, just in case some people flaw<br>I took a bad one with me to go count the stars<br>And see her body parts, I keep that black key card<br><br>[Chorus: Young Thug & Mariah the Scientist]<br>Ridin', ridin', ridin' (Yeah, yeah, yeah)<br>Right by your side, side, side, yeah (Side, side, side)<br>I took you far, I feel you, huh (Hard)<br>Bonnie and Clyde, you took the charge<br>No, you won't get tired, tired, tired (Tired, tired, tired)<br>If you stay with me for life, life, life (Life, life, life)<br>I can keep you runnin' wild, wild, wild (Wild)<br>Treat you like my child if throw in the towel<br>You might also like[Verse 2: Mariah the Scientist]<br>You sayin' I'm yours, and I could have it all<br>He just say the words, and he can rest assured<br>There's nothin' in this world that I ever wanted more<br>Nothin' like them girls that ever learned the fall<br>I said what I said, and I'll say it again<br>I'm the best for you and it is what it is<br>Love me some Spyda Wyda, turn that Miss to Mrs<br>Said I'm Mariah, I might change it to Williams<br>I can get you high like a G5, baby<br>Like it when I ride 'til I drive you crazy<br>I'll be by your side when you ride that Mercedes<br>Can't even get the coupe, ain't no room for the babies<br>Tell me what you want (Tell me what you want)<br>And I'll ride<br><br>[Chorus: Young Thug & Mariah the Scientist]<br>Ridin', ridin', ridin' (Yeah, yeah, yeah)<br>Right by your side, side, side, yeah (Side, side, side)<br>I took you far, I feel you, huh (Hard)<br>Bonnie and Clyde, you took the charge<br>No, you won't get tired, tired, tired (Tired, tired, tired)<br>If you stay with me for life, life, life (Life, life, life)<br>I can keep you runnin' wild, wild, wild (Wild)<br>Treat you like my child if throw in the towel<br>[Outro: Young Thug, Young Thug & Mariah the Scientist]<br>And I don't wanna lose your love",Mariah the Scientist,62,alternative r&b,https://i.scdn.co/image/ab6761610000e5ebb5e6be722db4720e820662e5
2HwZU79nHWVTrBbbNJ2g9U,2tIP7SsRs7vjIcLrU85W8J,2023-10-18,-5.579,95.006,0.901,4.0,1.0,TOO MUCH,76,"Jung Kook, Central Cee",https://i.scdn.co/image/ab67616d0000b273e60619a99ef31b512f992744,"[Chorus: Jung Kook & The Kid LAROI]<br>Uh, if we had the chance and the time to spend<br>Would you do it again? Would you do it again?<br>Was it too much? Uh, yeah (Too much)<br>Was it too much? Ayy, uh (Too much)<br>Now you're callin' your friends 'cause I'm gone again<br>When I'm back around, would you do it again?<br>Was it too much? Uh, ayy (Too much)<br>Was it too much? Uh, ayy (Too much)<br><br>[Verse 1: The Kid LAROI]<br>So tell me what got in the way<br>And how I thought it was good that it changed<br>And I'm sayin' I'm sorry again<br>Oh, I could never get out of my way<br>Hit the store and your wardrobe's replaced<br>And still all that you do is complain<br>You keep on throwin' it back in my face<br>And now you're tellin' me I need some space<br><br>[Pre-Chorus: The Kid LAROI & Jung Kook]<br>So I'm layin' in my bed, tripped off the shrooms now<br>I'll be dead before I'm without you now<br>Realizin' I'm addicted to you now<br>Come right here, baby, relax and cool down (Let's go)<br>What you sayin'? Hit me back with the move now (Ooh)<br>In my brain, no one else, it's just you now (Yeah)<br>Let me love you the way that I do now<br>I never knew how<br>You might also like[Chorus: Jung Kook & The Kid LAROI]<br>If we had the chance and the time to spend<br>Would you do it again? Would you do it again?<br>Was it too much? Uh, yeah (Too much)<br>Was it too much? Ayy, uh (Too much)<br>Now you're callin' your friends 'cause I'm gone again<br>When I'm back around, would you do it again?<br>Was it too much? Uh, ayy (Too much)<br>Was it too much? Uh, ayy (Too much)<br>Was it too much?<br><br>[Verse 2: Central Cee & The Kid LAROI]<br>Am I doin' too much?<br>Do you understand my slang and get my sense of humor?<br>When your girlfriends tell you I been fuckin' 'round<br>Would you believe me if I told you that they lyin' and that's just a rumor?<br>Send you my personal driver, man, this ain't just a Uber<br>You know it's serious when you stay at mine and bring your toothbrush<br>Extra panties in your bag and some makeup removers<br>You know I'm hardly on my own 'cause I stay with a shooter<br>She call me daddy, she got issues, I am not her father<br>Hop off the boat, into the jet, leave the yacht at the harbor<br>She injectin' with Ozempic, tryna stop her hunger<br>Huh, I wanked before you came so I can fuck you longer<br>S650, chauffeur driven, just tap your address in<br>Pack your bags and we can board the next flight, we can check in<br>Make sure you check that you ain't forgot your anti-depressants<br>Before I fly you out again and you make me regret it (Ooh)<br>[Pre-Chorus: The Kid LAROI & Jung Kook]<br>Uh, it's that time, pour it up, let's take one into the head<br>Top down, almost crashed 'cause I'm lookin' at your texts<br>Back and forth, and you mad about shit I never said<br>Double text, no reply, but I'm knowin' that you read it<br>What you sayin'? Hit me back with the move now (Ooh)<br>In my brain, no one else, it's just you now (Yeah)<br>Let me love you the way that I do now<br>I never knew how<br><br>[Chorus: Jung Kook & The Kid LAROI]<br>If we had the chance and the time to spend<br>Would you do it again? Would you do it again?<br>Was it too much? Uh, yeah (Too much, ooh)<br>Was it too much? Ayy, uh (Too much)<br>Now you're callin' your friends 'cause I'm gone again<br>When I'm back around, would you do it again? (Would you do it again?)<br>Was it too much? Uh, ayy (Too much)<br>Was it too much? Uh, ayy (Tell me, was it too much?)<br>Was it too much?<br><br>[Outro: The Kid LAROI & Jung Kook]<br>Was it too much? (Ooh)<br>Was it too much? (Ooh)<br>Was it too much?2",The Kid LAROI,79,australian hip hop,https://i.scdn.co/image/ab6761610000e5eb393666951ab8b14e9c4ed386
2MFFrpPKrGnyJuVjcfdm4w,4MCBfE4596Uoi2O4DtmEMz,2019-03-08,-3.997,88.933,0.038,4.0,1.0,Hear Me Calling,69,,https://i.scdn.co/image/ab67616d0000b2738b27d35aa2c6dcf99895d664,"[Intro]<br>Ring, do you hear me calling?<br>Purps On The Beat<br>Me no want no drama<br><br>[Chorus]<br>Do you hear me calling?<br>Do you hear me calling?<br>Me no want no drama<br>Not a fighter, a lover<br>Do you hear me calling?<br>Do you hear me calling?<br>Me no want no drama<br>I just want you, my darling<br><br>[Verse 1]<br>Break away and make a way to make it<br>Love the way you lookin' when you naked<br>Treat your heart just like a blunt of OG<br>Roll it up, I kissed it and I smoke it<br>Gots to be joking<br>Where in the fuck did you think you were going?<br>Foldin' and packin' your clothes like you ain't know I was gon' unfold it<br>Wine glass full of your emotions<br>Oh, Pinot Grigio, sippin', beautiful, heaven-soul woman<br>Me don't know, let me know, let me<br>In your heart, don't you dare forget me<br>I'm your fan, your posters on my walls inside my head, yeah, yeah<br>I'm your fan, your posters on my walls inside my head, yeah<br>You might also like[Chorus]<br>Do you hear me calling?<br>Do you hear me calling?<br>Me no want no drama<br>Not a fighter, a lover<br>Do you hear me calling?<br>Do you hear me calling?<br>Me no want no drama<br>I just want you, my darling<br><br>[Verse 2]<br>You drive me insane, no girl make me feel this way<br>Wait girl, you got your ways, girl you are my getaway<br>Wait, let me keep you safe<br>In exchange, give me brain, brain<br>You my main thing, turn around, bang bang<br>Hit the beach in LA like you a beach ball<br>Me and you in the Lambo truck, you start it up and skrrt off<br>We park after dark at the park by the mansion, take your skirt off<br>Oh, me can't wait to get all up inside of it<br>My heart is racing, every time I'm tastin' it<br>Wait until the drugs fade out<br>Hate making love when I'm faded<br>That's because I wanna feel it<br>Girl, you give me the best feelin'<br>Yes, girl you're the best, take away stress, love me to death<br>Even when I'm a mess<br>[Chorus]<br>Do you hear me calling?<br>Do you hear me calling?<br>Me no want no drama<br>Not a fighter, a lover<br>Do you hear me calling?<br>Do you hear me calling?<br>Me no want no drama<br>I just want you, my darling (Darling)<br><br>[Outro]<br>Ring, do you hear me calling?<br>Me no want no drama<br>Ring, do you hear me calling?<br>Me no want no drama61",Juice WRLD,85,"chicago rap, melodic rap, rap",https://i.scdn.co/image/ab6761610000e5eb1908e1a8b79abf71d5598944
2U5WueTLIK5WJLD7mvDODv,4MCBfE4596Uoi2O4DtmEMz,2020-07-10,-6.13,149.972,0.064,4.0,0.948,Wishing Well,79,,https://i.scdn.co/image/ab67616d0000b2733e0698e4ae5ffb82a005aeeb,"[Intro]<br>Mm-mm, mm-mm-mm-mm, mm-mm-mm, uh<br>I can't breathe (Chopsquad), I can't breathe, 999<br>Waiting for the exhale<br>I toss my pain with my wishes in a wishing well<br><br>[Chorus]<br>I can't breathe, I'm waiting for the exhale<br>Toss my pain with my wishes in a wishing well<br>Still no luck, but oh well<br>I still try even though I know I'm gon' fail<br>Stress on my shoulders like a anvil<br>Perky got me itching like a anthill<br>Drugs killing me softly, Lauryn Hill<br>Sometimes I don't know how to feel<br><br>[Verse 1]<br>Ring-ring, phone call from depression<br>You used my past and my memories as a weapon<br>On the other line, I talk to addiction, huh<br>Speaking of the devil, all the drugs, I miss them<br>This can't be real, is it fiction?<br>Somethin' feels broke, need to fix it<br>I cry out for help, do they listen?<br>I'ma be alone until it's finished<br>You might also like[Pre-Chorus]<br>This is the part where I tell you I'm fine, but I'm lying<br>I just don't want you to worry<br>This is the part where I take all my feelings and hide 'em<br>'Cause I don't want nobody to hurt me<br><br>[Chorus]<br>I can't breathe, I'm waiting for the exhale<br>Toss my pain with my wishes in a wishing well<br>Still no luck, but oh well<br>I still try even though I know I'm gon' fail<br>It's stress on my shoulders like a anvil<br>Perky got me itching like a anthill<br>Drugs killing me softly, Lauryn Hill<br>Sometimes I don't know how to feel<br><br>[Verse 2]<br>Sometimes I don't know how to feel<br>Let's be for real<br>If it wasn't for the pills, I wouldn't be here<br>But if I keep taking these pills, I won't be here, yeah<br>I just told y'all my secret, yeah<br>It's tearing me to pieces<br>I really think I need them<br>I stopped taking the drugs and now the drugs take me<br>[Pre-Chorus]<br>This is the part where I tell you I'm fine, but I'm lying<br>I just don't want you to worry<br>This is the part where I take all my feelings and hide 'em<br>'Cause I don't want nobody to hurt me<br><br>[Chorus]<br>I can't breathe, I'm waiting for the exhale<br>Toss my pain with my wishes in a wishing well<br>Still no luck, but oh well<br>I still try even though I know I'm gon' fail<br>It's stress on my shoulders like a anvil<br>Perky got me itching like a anthill<br>Drugs killing me softly, Lauryn Hill<br>Sometimes I don't know how to feel224",Juice WRLD,85,"chicago rap, melodic rap, rap",https://i.scdn.co/image/ab6761610000e5eb1908e1a8b79abf71d5598944
2uTrdatngtB000duMrfbiV,4MCBfE4596Uoi2O4DtmEMz,2019-03-08,-6.004,159.968,0.307,4.0,1.0,Feeling,69,,https://i.scdn.co/image/ab67616d0000b2738b27d35aa2c6dcf99895d664,"[Intro]<br>This a one-take gang, isn't it, Max Lord?<br>This is a one-take-ass song (Yeah, uh-huh)<br>(999, Juice) Perc' give me a feelin' (Sheesh)<br>My girl just walked into the building (Hi bae, hey)<br>Huh, uh<br>Percs give me a feeling, I feel it (Do you feel it? Ayy)<br>Percs give me a feeling, I feel it (Man, goddamn)<br>Like Black Eyed Peas<br><br>[Chorus]<br>I got a feeling, uh<br>Percs help me feel it, I feel it, uh<br>Problems, I numb and conceal them<br>It's kinda like my feelings, but I still feel them<br>I just walked in the building<br>Look like a million, but I'm worth more than a million<br>I don't need no Ritalin, I'm focused on the millions<br>Disregard civilians<br>Until I get a house with a moat and a pavilion (Let's go, let's go, let's go)<br><br>[Verse 1]<br>I reek of good vibes<br>Smokin' on reefer, I'm high<br>Percocet fever<br>The type of pill to make you scratch until your nails gone (Yeah, yeah)<br>Drugs in my head, you heard what I said<br>No five, no ten, no fifteen, twenty, just Perc-30s in my meds<br>I told my mama I'm here to stay, no, she won't catch me dead<br>I'm too much of an idol, nigga, no Ryan Seacrest (Oh yeah)<br>Do it by my V-lone, 'lone<br>(This is about you, not me)<br>Alone, alone, alone (Slatt, slatt, slatt, slatt)<br>You might also like[Chorus]<br>I got a feeling<br>Percs help me feel it, I feel it, uh<br>Problems, I numb and conceal them<br>It's kinda like my feelings, but I still feel them<br>I just walked in the building<br>Look like a million, but I'm worth more than a million<br>I don't need no Ritalin, I'm focused on the millions<br>Disregard civilians<br>Until I get a house with a moat and a pavilion<br><br>[Verse 2]<br>'Til I get a house with a moat and a pavilion<br>Walked into your building, nigga, I'm a villain<br>Feel like Dragon Ball, bitch, I'm Goku and you Krillin<br>Bickin' back, I'm boolin', these niggas be chillin'<br>All up in they feelings, me, I'm just winning<br>W-I-N-N-I-N-G (Spell it)<br>Boy, it's ain't no ""I"" in team but it's an ""M-E"" in team (Fuck)<br>I meant it's a ""me"" in team (Yeah)<br>I know I just fucked up, but bitch, I'm still the freestyle king, whoa (On God, on God)<br>Her pussy wetter than olive oil, my watch cost a hundred more<br>My new girl a Lamborghin', your girl a Honda Accord<br>Mama told me I gotta stay focused, told her I am not a Ford<br>Focused, you notice when it disappear like hocus pocus<br>[Chorus]<br>I got a feeling<br>Percs help me feel it, I feel it, uh<br>Problems, I numb and conceal them<br>It's kinda like my feelings, but I still feel them<br>I just walked in the building<br>Look like a million, but I'm worth more than a million<br>I don't need no Ritalin, I'm focused on the millions<br>Disregard civilians<br>Until I get a house with a moat and a pavilion (Let's go, let's go, let's go)39",Juice WRLD,85,"chicago rap, melodic rap, rap",https://i.scdn.co/image/ab6761610000e5eb1908e1a8b79abf71d5598944
3oDkdAySo1VQQG0ptV7uwa,4MCBfE4596Uoi2O4DtmEMz,2018-12-10,-5.515,163.935,0.088,4.0,1.0,Lean Wit Me,81,,https://i.scdn.co/image/ab67616d0000b273f7db43292a6a99b21b51d5b4,"[Intro]<br>Drugs got me sweatin', but the room gettin' colder<br>Lookin' at the devil and the angel on my shoulder<br>Will I die tonight? I don't know, is it over?<br>Lookin' for my next high, I'm lookin' for closure<br><br>[Chorus]<br>Lean with me, pop with me<br>Get high with me if you rock with me<br>Smoke with me, drink with me<br>Fucked up liver with some bad kidneys<br>Lean with me, pop with me<br>Get high with me if you rock with me<br>Smoke with me, drink with me<br>Fucked up liver with some bad kidneys<br><br>[Verse 1]<br>Told her if I die, I'ma die young<br>Every day I've been gettin' fucked up<br>Finally know the difference between love and drugs<br>Shawty tell me I should really sober up<br>This shit ain't fiction, it's too real, too real<br>Fuck one dose, I need two pills, two pills<br>I'm lookin' for trouble so I know I'm gonna find it<br>Ring, ring, plug hit my phone, perfect timin'<br>I know I'm not right<br>But I'm not wrong, no, I'm not wrong<br>Girl, you hate it when I'm too high<br>But that's where I belong, where I belong<br>You might also like[Chorus]<br>Lean with me, pop with me<br>Get high with me if you rock with me<br>Smoke with me, drink with me<br>Fucked up liver with some bad kidneys<br>Lean with me, pop with me<br>Get high with me if you rock with me<br>Smoke with me, drink with me<br>Fucked up liver with some bad kidneys<br><br>[Verse 2]<br>Eyes red, no Visine<br>Crashed the Mustang, no Saleen<br>Yeah, I love beans, yeah, I love lean<br>I laugh when they ask if my piss clean<br>Huh, smoke with me, huh, pop with me, huh<br>Ayy, Gucci store, come and shop with me<br>If I overdose, bae, are you gon' drop with me?<br>I don't even wanna think about it right now<br>Let's get too high, reach a new high<br>Take the shrooms and the pills at the same time<br>Went to Hollywood thrills from the street life<br>Took too many drugs, now I don't feel right<br><br>[Chorus]<br>Lean with me, pop with me<br>Get high with me if you rock with me<br>Smoke with me, drink with me<br>Fucked up liver with some bad kidneys<br>Lean with me, pop with me<br>Get high with me if you rock with me<br>Smoke with me, drink with me<br>Fucked up liver with some bad kidneys (Bad kidneys)<br>[Outro]<br>Oh-oh<br>Oh-oh-oh<br>Oh-oh-oh176",Juice WRLD,85,"chicago rap, melodic rap, rap",https://i.scdn.co/image/ab6761610000e5eb1908e1a8b79abf71d5598944
3XRQT7EoS4U87rUuJwg5P3,4MCBfE4596Uoi2O4DtmEMz,2018-12-10,-7.623,156.906,0.469,4.0,1.0,Hurt Me,74,,https://i.scdn.co/image/ab67616d0000b273f7db43292a6a99b21b51d5b4,"[Intro]<br>Enviyon on the mix<br><br>[Pre-Chorus]<br>Turned to a whole different person, drive my whip<br>Crash my whip, off the drugs, I'm swervin'<br><br>[Chorus]<br>Sticks and stones may break my bones<br>But the drugs won't hurt me, the drugs won't hurt me<br>Ex-girlfriend keeps calling my phone<br>But the bitch can't hurt me, so I'm not worried<br>All alone, did it on my own<br>So I show no mercy, I show no mercy<br>With my bros, but I got my pole screaming<br>""Please don't urge me, please don't urge me"", yuh<br><br>[Verse]<br>Screaming, ""Please don't urge me""<br>And fuck these hoes, all they do is irk me<br>I smoke my dope and I pop my perky<br>And lock my phone 'cause these hoes be lurking, yuh<br>Yeah, these hoes be lurking<br>A bad lil' bitch with her hips so curvy<br>I drive my whip, off the drugs, I'm swervin'<br>She ride my dick, off the drugs, she swervin', woah<br>You might also like[Pre-Chorus]<br>Turned to a whole different person, drive my whip<br>Crash my whip, off the drugs, I'm swervin'<br><br>[Chorus]<br>Sticks and stones may break my bones<br>But the drugs won't hurt me, the drugs won't hurt me<br>Ex-girlfriend keeps calling my phone<br>But the bitch can't hurt me, so I'm not worried<br>All alone, did it on my own<br>So I show no mercy, I show no mercy<br>With my bros, but I got my pole screaming<br>""Please don't urge me, please don't urge me"", yuh (Yuh)<br><br>[Outro]<br>Turned to a whole different person, drive my whip<br>Crash my whip, off the drugs, I'm swervin'36",Juice WRLD,85,"chicago rap, melodic rap, rap",https://i.scdn.co/image/ab6761610000e5eb1908e1a8b79abf71d5598944
