track_id,main_artist_id,released_date,loudness,tempo,tempo_confidence,time_signature,time_signature_confidence,track_name,track_popularity,other_artists,track_image_url,lyrics,main_artist_name,main_artist_popularity,main_artist_genre,main_artist_image_url
41hQM30w8WmpS8yRBMHbYB,4YUcg2ee9TxMNdjhAxzZBF,2022-05-19,-6.366,127.978,0.675,4.0,0.983,SANS FLEURS,45,Luv Resval,https://i.scdn.co/image/ab67616d0000b27301a24967f3819a03ef551f01,"[Paroles de ""SANS FLEURS"" ft. Luv Resval]<br><br>[Intro : Ashh]<br>Hey (Hey, hey)<br>Hey (Hey, hey)<br><br>[Couplet 1 : Ashh]<br>Dans Paname, j'ai des couplets de Ashh (Yeah), dans l'asphalte, j'ai découpé des haches<br>Sur la lame, j'ai découpé ce hasch', dans les abysses, j'ai trouvé ce cash (Trouvé ce cash)<br>J'fuck les âmes, mec, les présidences, dans la city, que des dames et les brasiers se penchent<br>Insistant, tu sens qu'les abysses tremblent, quand on marche dans l'island, qu'on attaque à distance<br>J'ai les plans, le réseau dans l'esprit (L'esprit), grosse vague, saute sans jet ski (En jet ski)<br>R.E.S.Val d'or et {?}, coup d'sabre, tu ne peux pas v'-esqui (V'-esqui)<br>Dans la vallée, on parlait d'estime, dans le carré, que des salopes, c'est grave des déchets<br>Dans la soirée, j'ai pas eu mes styles, faut se barrer, un métaux, j'ai cassé Dustin<br>P'tite caisse, dans la valise, j'ai les sommes (J'ai les sommes)<br>En ivresse, dans la vallée, j'vois des hommes (Des hommes)<br>Finesse, dans la soirée, j'termine sobre<br>Je la fume en vitesse avant d'aller vers les anges<br>P'tite caisse, dans la valise, j'ai les sommes (J'ai les sommes)<br>En ivresse, dans la vallée, j'vois des hommes (Des hommes)<br>J'maîtrise pas, pure drogue, dans le carré, j'ai le malin<br>Insiste pas, fume ça sans me parler mal<br><br>[Couplet 2 : Luv Resval]<br>Yah (Yah), Legolas (Legolas), j'ai l'adresse (Legolas), flamme du Condor, on descend<br>L'odeur du sol me rappelle celle de l'essence, très étrange est le lagon d'eau<br>Je zoome sur la ville comme le dragon Smaug, 200 en Merco, y a pas d'contrôle<br>Tu sens le poison sur ma lame (Ma lame), j'envoie des bastos et la came (Woah)<br>La SACEM à Francis Lalanne (Woah), dans le Ford, miracle, t'écouteras tout c'qu'on t'dira (Skurt, skurt)<br>Y aura pas d'bons dirhams, y aura jamais d'bons pirates (Skurt, skurt), real, real<br>Mais ça dérape dans la Mera, j'suis Bagheera, c'est comme si j'étais dans Tera<br>C'est moi le dernier qui terrasse sur la terrasse, dans l'opéra (Nion, nion, flash)<br>Viens nous voir, après tu verras (Viens, viens), viens nous voir, après tu verras (Viens)<br>Quand on ppe-ra, c'est du H+, mes intérêts sur le cash pourraient t'enterrer noir comme le pelage du taureau<br>J'ai une capuche comme un Nazgul, wow (Wow) mais ce soir, on allume un stick (Un stick)<br>Et le pistolet shoote, tue comme Rick (Woah), passe dans la zone, on a besoin d'un crime<br>Ma magie s'remélange, fait sortir un brique (Yah), pour coincer la dague, dans ton cou, je m'applique<br>O-Okay, Luv, ils sont nuls en bref, okay, Resval, tire dans la tête<br>Les armées se lèvent, j'ai la ceinture, le belt, slash, l'épée qu'j'ai est forgée par les elfes<br>Les têtes d'tous les rois tomberont par les glaives (Glaives), le professeur enseigne à l'élève (Le prof)<br>Il a senti le mal en l'élève, ils veulent avoir la pomme, pas celle d'Adam et Eve (La pomme, la pomme)<br>Yah, j'ai la démarche du Seigneur, du marquis (Woah)<br>J'ai le dard métal royal, je slash kill<br>Quarante gobelins, je découpe avec Ash Kidd (Nan, nan)<br>Au début d'la guerre, j'entends sonner les matines<br>On part, go (Go, go, go), go (Encore, encore), yeah, yeahYou might also like",Ashh,49,"french hip hop, rap calme",https://i.scdn.co/image/ab6761610000e5ebcb5abd595c4f4702f6172746
7o42ikuu4a51sk1dp1Kxsv,4YUcg2ee9TxMNdjhAxzZBF,2022-01-13,-10.01,113.081,0.428,4.0,0.982,SEIZE,25,,https://i.scdn.co/image/ab67616d0000b2738bc9bd37777652e4edac8ddc,"[Paroles de ""SEIZE""]<br><br>[Intro]<br>Oh, oh, oh, oh<br>Oh, oh, oh, oh<br>Oh, oh<br>Eh<br>Oh, oh, oh, oh<br>Oh, oh, oh, oh<br><br>[Couplet unique]<br>Gros j’ai les sentiments noirs<br>La vie sans cash, c'est pas pareil<br>Gros, là, j'suis seul dans la boîte<br>Gros, là, j'mets tout dans l'appareil<br>J'me rappelle de mon adolescence<br>J'ramène le fer, amène l'essence<br>Gros, j'étais seul dans la boîte, yeah<br>Rajoute des zéros, c'est carré<br>Là, j'reste sur Paris, j'ai des billets verts mais c'est tout gris<br>L'impression qu'le ciel nous a puni, j'ai Henny et Jack dans le bеlly<br>C'est mort là, faut qu'j'aille à Abu Dhabi, dans le néant, j'ai pas d'appui<br>J'crois qu'lе ciel nous a maudit, j'crois qu'les démons applaudissent<br>J'vois que du noir en fait<br>Gros, c'est ma vida, là, j'sors de la boîte, j'suis complétement teinté<br>J'suis dans le Viano, fume un peu d'drogue, quand les pensées sont noires<br>Là, j'sors du studio, j'mets ta bitch sur le piano<br>Parle à mon démon, j'crois qu'on s'connaît pas, je n'fais que ter-mon, dans c'bât', il fait tour noir<br>J'suis dans l'appart' et ça tape dans le couloir<br>J'chante sur la gratte, il s'fait tard, j'ai ta bitches, sa teinture<br>Sur la way, j'accélère, mets ta ceinture<br>J'ride avec elle, on rentre dans la pénombre<br>Il m'faut ce cash, que j'retape la peinture<br>Moi, c'soir, j'vais pas rentrer (C'est mieux)<br>Regarde-moi rentrer (Ces billets)<br>Regarde-moi dans les yeux si tu veux (Y a qu'le Diable qui harcèle Dieu)<br>J'ai vu d'la neige tomber en juillet<br>J'ai vu ton coeur, ton âme scintillée<br>J'amène cette blonde avec moi, au dîner<br>Jamais sans bombe<br>Ici, tout est noir<br>J'rallume cette dernière flamme<br>J'suis pas à deux doigts de vriller<br>J'vais pas baiser une fan<br>T'entends ma voix dans mes pensées<br>Ma tête sais quand j'suis pas seul<br>J'fais ça, j'suis même pas drogué<br>Ouais, j'entends la voix dans l'talkie<br>You might also like[Outro]<br>Okay, ouais<br>Noir<br>C'est pas tout, accélère",Ashh,49,"french hip hop, rap calme",https://i.scdn.co/image/ab6761610000e5ebcb5abd595c4f4702f6172746
4aWIBaSkqbpFzJzlWoKkGT,2JzVKuLUNVArGn13XThuTi,2016-11-18,-10.73,148.631,0.089,4.0,0.882,Je suis Vaiana,48,Cerise Calixte,https://i.scdn.co/image/ab67616d0000b273460fc9b0c79ed8ce87b5bcd6,"[Couplet Unique]<br>Demain c'est loin, demain c'est là<br>Là j'fume un shit il est excellent<br>Et quand j'suis en fumette bah j'accélère<br>Dis pas qu'c'est lui on m'a dis qu'c'est l'autre<br>Des fois j'rentre dans l'game j'nique tout<br>Mais ça m'boycotte comme Benzema<br>Mets moi l'instru qu'j'y nique ses morts<br>A l'affût comme un receleur<br>Connu comme un best-seller<br>J'suis en zone faut qu'j'évite les motards au rond point d'Castellane<br>Dans c'monde, y'en a qui vident des Burn<br>Et d'autre qui vident des burnes<br>Le shit il s'effrite comme du beurre<br>Les kepis rentrent ça lance des pierres<br>Pierre, feuille, ciseaux<br>Prends-moi des feuilles, un flash, une bouteille d'eau<br>Il t'fais croire à sa tête d'ange on m'a dis qu'il taquine au Taekwondo<br>Les gars vous m'avez tous blessé<br>Ca y est j'ai plus d'place j'ai qu'un dos<br>Gros j'peux compter qu'sur mon frère<br>On m'a trop compté j'ai b'soin d'aucun doigts<br>J'fais pas l'gratteur quand on me dois<br>Des fois tellement j'oublie, On dirait qu'on m'a jeté dans l'tiek<br>Et qu'j'ai tourné toute ma vie comme une toupie<br>Les kepis passent j'les regardent<br>Moi j'viens d'Marseille j'suis né à Beauregard<br>Merci Maman j'ai un beau regard<br>Moi j'aime tellement la musique que j'pourrais traîner avec des Rockeurs<br>Et t'casses pas la tête, j'traîne pas, j'parle pas avec toi si j'ai des rancoeurs<br>Ma faiblesse c'est mon grand coeur<br>J'suis fier comme mon grand-père<br>Asics pas b'soin d'crampons<br>Pour t'faire des grands ponts<br>En mode DP, en mode DP, besoin d'degun j'suis équipé<br>Il tourne sa veste il oublie tout, j'croyais qu'c'était ton équipier<br>J'braque le game degun qui bouge<br>Pour moi y'a des gens qui bouge<br>S'fait l'voyou avec des faibles, devant des gros j'ai vu des gens qui bug<br>Sur mon dos y'a des gens qui bectent, j'ai pas d'remède, pas d'antidote<br>Ca voit que j'calcule plus personne, ils m'jettent l'oeil en mode anti-potes<br>Poto j'pose après toi lache pas d'requin sur l'anti-pop<br>T'es bizarre j'dirais pas plus tu trâines qu'avec des gens sous coke<br>J'entends qu'ça parle de ma clique<br>Ca lance des piques, ça veut mon buzz, mon compte snap<br>Ces jaloux ils auront que ma dick<br>J'suis posé d'vant GTA, que j'cabre en PCJ-600<br>J'sors d'chez moi j'prends l'RS5<br>La miss m'parle veut qu'j'y touche ses seins<br>Ca lance des rumeurs sans préciser<br>Faudrait couper leurs langues au ciseau<br>Wesh, vous m'avez fais une blessure à vie un peu comme Djibril Cissé<br>Bientôt l'été, j'ai la Bandite<br>Faut qu'j'sorte Honda au Berverly<br>Pour m'évader j'm'en vais vers l'eau<br>Quand j'suis ko j'm'en vais vers l'lit<br>Frero j'vois dans tes yeux t'es louche, en plus tu nous fais l'intello<br>La victime rajoute une couche<br>L'OPJ vu qu'il traîne l'interroge<br>T'es pas plus intelligent parceque t'es riche<br>T'inquiète j'oublie pas j'me rappelle encore<br>La valeur d'l'argent quand c'était rèche<br>J'vais plus au restaurant, j'vais plus au cinéma<br>Même si demain ça marche plus<br>J'irais pas tchouper en mode ""Re signez moi""<br>J'te rends fou comme Babaraï<br>J'vois un Karaï sous casque Araï<br>Fais l'vaillant avec moi tu m'connais gros j'te rendrais l'appareil<br>Si t'as du vice sens-toi visé, c'est trop abusé<br>T'as eu d'la chance quelqu'un s'est mis sur mon champ d'vision quand j'ai visé<br>J'ai pas changé toujours le même, survet nike ensemble de foot<br>Avec la rue moi j'fais des feats<br>Et comme tout humains moi j'fais des fautes<br>J'montre pas mes faiblesses sur l'terrain déçu comme Sergio Ramos<br>Et combien m'ont jeté l'oeil quand j'ai sorti l'dernier gamos<br>Perso j'suis encore au pain chips j'graille pas tous les jours des gambas<br>Quand j'étais p'tit chez mon père tous les weekends j'attendais l'marchand d'glaces<br>Ca f'sait sept mois qu'j'étais sur mute j'commençais à plus tenir en place<br>Au collège j'étais ce genre de type qui écouté d'la musique en classe<br>Ecouteur dans la manche, crois pas ici la vie c'est moche<br>Hier j'ai donné un ensemble DP à un vieux qui faisait la manche<br>Ici ça combat au couteau, tête à tête contre un poto<br>Le poto il a marché toute sa vie j'crois bien qu'les pieds y sont kités<br>Ouais, la bombe est préparée il m'reste plus qu'à appuyer sur l'bouton<br>Y'aura d'la musique envoûtante, 2018 on choque des tantes<br>Dans ma life il fait gris, alors j'cours toujours vers l'beau temps<br>J'savais pas qu'ça suçait autant, et qu'ça suivait comme des moutons<br>Ouais, YZF debout, y'a d'la boue sur l'gardeboue<br>Et regardez bien hein bande de fous vous allez entendre parler de nous<br>On rôde dans les coins sombres où il fait tout noir quand y'a plus d'soleil<br>T'es un pilote et tout mais j'te fais plus confiance depuis qu't'as fais l'soleil<br>Ca veut s'fumer, juste pour un regard, ça part en guerre en vrai frangin si j'envoie des gens y sera volé l'engin<br>J'suis pas dans l'mannequinat, mais j'te détend comme un kiné<br>Une connexion dans l'ghetto et c'est encore une équipe qui nait<br>Joue pas les civs ils ont mis une Clio sinon ils nous auraient déjà alignés<br>Avec les têtes perchées qu'on a même les tapins il veulent pas piner<br>Ouais, Ils comprennent pas après tout et puis merde<br>Les gens m'voyent comme un Brinks c'pour ça qu'j'rôde capuché sur l'chemin d'la Pinède, ah punaise !<br>Le frangin il sent d'la bouche on dirait il a écraser une punaise<br>Quand j'suis entouré d'fumeur frangin jamais ça s'arrête<br>Quand j'suis tout seul c'est en 2 mois qu'j'fume sur la moitié d'la plaquette<br>J'fais l'guetteur à l'affût, des ennemis ou d'la Mondéo<br>Ca se charcle pour d'l'argent ou parce que le petit veut monter haut<br>Ca m'fait plaisir ça me soutien ça m'fait le signe JuL jusqu'à Paname<br>Le sac Qéchua il m'rend fou ça y est j'ai racheté la Banane<br>J'écris là ils font qu'm'saturer, j'suis en train d'péter ma durite<br>Tu fais l'mec moi j'veux pas d'enfants fais gaffe si elle pète la Durex<br>J'vais les baiser jusqu'à la moelle<br>J'fume le shit couleur Caramel<br>Dans l'secteur ça écoute Djadja Dinaz ou Moha LaSquale<br>Il m'reste un point sur le permis mais j'me permet<br>J'fume j'suis hyper mou les yeux cernés<br>C'est pas facile à nous de nous cernés<br>RS6 des go-fast, l'equipe elle nous bloque au feu rouge<br>Wesh doucement j'suis qu'un rappeur tu fais l'chaud toi j'ai pas compris<br>Attends t'étonne pas si par terre c'est rouge<br>Tu dis d'la merde sept sur sept c'normal t'attire les mouches<br>J'me sens bien dans mes rêves, j'vois mes potes sans manque d'euros<br>Elle fait la star elle est pourrave j'crois j'vais la jeter vers Corot<br>Ouais, là j'suis vers Airbel ça défauche des briques au kiri<br>On attire les curieux, quand les problèmes nous tombent dessus<br>Y'en a qui rits<br>Y'en a qui rimes, y'en qui rames, y'en a qui roulent<br>Pendant qu'je roule et qu'j'fais des tours d'la zone<br>On écoute des sons à l'ancienne<br>J'ai plus vu ta tête ça fait longtemps j'vois qu't'es préssé on s'reverra, on s'fera<br>Des soirées comme avant freestyles, bambou, et cetera<br>Y'a des putes, y'a des bons, et des salopes donnent des noms d'autre qui fondent tous les jours qui font les mecs carré alors qui doivent des ronds<br>Y'en qui galèrent sur l'terrain et c'est pas une histoire d'ballon<br>Y'a un poto qui s'est fait pété hier et j'crois bien qu'c'est une histoire d'balances<br>Sur l'parking j'suis bien garé, tu veux m'doubler change tes galets<br>Ca crève, ça roule sur la galettes, ça porte ses couilles pour une palette<br>Ouais, Vodka Redbull, gros ciseau comme Gareth Bale<br>Moi j'nique tout j'm'arrête pas, même si la fille elle à l'air belle<br>Ouais gros faut qu't'arrête, maintenant faut qu'tu traces ta route<br>J'prefere faire mes sous seuls plutôt que d'gratter des cigarettes<br>Entre frères ça s'carotte, y'en a marre des toutes ces mascarades<br>Elle était bien, t'as tout niqué, t'as fais coulé son Mascara<br>Faut pas trahir tes camarades, c'est normal qu'tes gars marronnent<br>Lui ça fait deux mois qu'tu l'esquives tout parceque t'y dois un marron<br>J'ecris j'ai les crocs assis, avec mon survet' d'la Croatie<br>J'connais des gens y grimpent chez toi pourtant ils font pas d'l'acrobatie<br>Sur deux minutes j'ai les courbatures<br>Tous les trois jours j'change de voitures<br>La France elle me kiffe pas, j'la kiffe pas<br>Laissez-nous faire la dictature<br>Tu crois qu't'as raison j'te dis qu't'as tord<br>Fais gaffe les flics te plaquent à terre<br>J'suis donc caché comme un Qatar<br>Pendant qu'toi tu loupes des locataires, ouais batârd<br>Batârd va<br>Eux ils sont pas content quand tu passes en soucoupe ils préféraient te voir passer en dromadaire<br>Tout pour la dar, faut d'attendre au pire quand tu montes ton empire<br>Tout pour la dar ouais<br>Ca fait: Audi, RS6, pneux qui crissent<br>PGP sur l'té-co pour esquiver les écoute de la Police<br>Equipé comme à Napoli, gravé comme la tête à Boli<br>Ca s'fait la guerre avec des types ou du stup ou pour Ma Jolie<br>Ouais, C'est dieu qui donne c'est pas moi qui donne des carrières<br>Wesh au fait poto, c'est toi qui a fait la boulette sur l'siège arrière?<br>Sur l'compteur: 320, j'rétrograde, j'touche pas l'frein<br>Divorce seul s'cherche en vain, elle élève toute seule ses trois enfants<br>Mon poto j'l'ai plus vu ils m'a dis a tout à l'heure, un an ferme<br>Mais ça va il garde la forme, malgré tout cet enfer<br>C'qui te tue pas t'rend plus fort, y'a les képis pas une seconde<br>J'les ai vu toute la semaine et j'ai des potos qui sont plus de ce monde<br>Wesh alors, wesh alors, j'vois le p'tit il s'fait chaler<br>Moto volée ça fait rupter la deuxième dans les p'tites allées<br>Faudra pas venir chialer, y'a un bon dieu si t'es jaloux<br>Toi tu sens l'contrôle le sang là ta conduite elle est chelou<br>Ouais, y'a qu'des vaillants chez nous, respect à ceux qui font du fric<br>Chez moi les Mamas elle font des briques, et les plus grands ils font des Brinks, ouais<br>Histoire de zoo, histoire de shit de machin<br>Histoire pour pas un y'a aussi les anciens là dans les machines<br>Les après midi au bar, ça parle à l'oreille et ça opère<br>L""argent ça vient et ça repars et crois moi c'est la même jusqu'à Aubert<br>On vit des trucs choquants, j'comprenne ceux qui prennent des frappes<br>J'comprends lui qui croit en plus un tous qu'aux films et qui fait que des flops<br>Ouais, c'est rien faut pas lacher, tu vas leur plaisir après<br>Les jaloux c'est eux qui feront tous pour te faire déraper<br>J'suis là depuis l'départ, j'fais ça par amour, j'veux soulever la coupe<br>Batârd dans l'écart, j'suis comme ça ma couille<br>Ouais, à gauche quand je pleure, à toi quand je ris<br>Pense à mes galères à 5 du mat d'vant la Boulangerie<br>Ouais, j'traîne au tiek j'suis riche, y'en qui comprennent pas<br>M'demande qu'es-ce que j'fous là<br>J'lui dis: ""J'sais pas j'suis avec les frangins là j'fume d'la Moula""<br>Marseille c'est toujours cramé, on t'reconnais même s'tu camoufle<br>On s'plaint toujours comme des zoives on disant qu'la merde ça arrive qu'à nous<br>J'pars du secteur, j'fais un tour au Nord pour finir au Vieux-Port<br>J'ai vu les civs dans un coin là ils avaient éteints les phares<br>J'ai vu un délits, des jeunes sans casques pris en flagrant délit<br>Ils les on arrétés comme si c'était de gros voyous de Medellín<br>Refus d'obtempérer, tu peux plus temperer, pour eux t'es rien<br>Combien tu paierais pour sortir d'la mais l'OPJ il veut t'enterre<br>Chemise ouverte, chaîne en or, Big up les anciens<br>On a grandi avec du Petit Frère ou du Demain c'est loin<br>Y'a des couteaux askip, tu vois de tout au Beaumettes<br>La mama sort du parlu', en pleur p'tit sèche les paumettes<br>Ca compte les heures, les secondes, les jours de grâces<br>Tu tiens plus en place, tu penses à dehors comment t'refaire une place, ouais<br>Du passé au présent le p'tit à grandi, fais des coups pour s'acheter des armes, ou devenir les plus gros des bandits<br>Voiture, Audi, moto, Bandite, son poto le chauffe<br>Son prochain coup a lui seul le Aldi<br>Rêvant de gadjis, il fait des cauchemars où il s'voit soulever<br>Où la juge l'achève, où ils voient tous ses rêves lui passer sous le nez<br>Ecoeuré dans la geôle tu cris qu'importe pour du jus Brisy<br>Gatêau Coco tu souhaites à personne de venir ici<br>Au reveil, t'es un peu stréssé, tu regardes par la fenètre<br>Tu regardes si le mot tourne, si les guetteurs sont postés<br>Prêt à encaisser<br>Prêt à crier: ""Portier y'a un client suspect""<br>""Fouille-le fais le patienter, attends là toi sur le côté""<br>Mmh ça s'voit c'est un civ, il deveient un peu impulsif<br>En plus il a trop une tête a passer sur enquête exclusive, ouais<br>Le poto il est parti au casin' il doit des tentes<br>Il a misé tant donc il a tout perdu dur de s'détendre<br>Et dans la zone, y'a ceux qui tracent et ceux qui passent pour pas win<br>Comme à Fifa y'a ceux qui attendent la gagne et ceux portent la guige ouais<br>Devant l'garage ça pine, ça prend la mâche l'aprem<br>Laisse pas les armes à la kham, on sait jamais tant d'main ça pèteYou might also like",Johanne Garneau,34,,
4CenhiKhOC0zo6CZf26gu8,5pqlDQB8ZaX1LcDd7wyDet,2022-07-25,-8.199,124.935,0.647,4.0,0.943,WAY WITH THE MONEY,0,,https://i.scdn.co/image/ab67616d0000b2731a65ceec0fcd99ab7f4a85dd,"(Hook; Jxhines)<br>Underneath this club lights<br>Baby we can disappear<br>Girl I swear the moves right<br>Lets just dip up out of here<br>(Yeah)<br>I know, you feel it<br>I know, you do<br>Girl all, I’m saying<br>Is I, want you<br><br>(Verse; IV Montana)<br>Riding around like a carousel<br>Body ten she caramel<br>F***ing we’ll never tell<br>I beat it up no show n tell<br>Red bottoms, dolce gabbana<br>She drippin to much sauce<br>Her p**** way to moist<br>She swallow just enough<br>We up and down like a summer salt<br>Baby don’t fall off<br>Way she stair at me when she ridin me<br>She bring it in my soul<br>I love the way she do it<br>But d*** she do to much<br>So baby hush your mouth<br>And layback take this n**<br>(Woah)<br>When my draids touch her body make her go insane<br>Way she shake that a** I forget her name<br>I’m throwin all this money while she do her thing<br>And throw that a** let me watch you do it<br>Round n round it go<br>If it ain’t now I’ll never know (x2)<br>And shake that a** for me<br>You might also like(Hook; Jxhines)<br>Underneath this club lights<br>Baby we can disappear<br>Girl I swear the moves right<br>Let’s just dip up out of here<br>(Yeah)<br>I know, you feel it<br>I know, you do<br>Girl all, I’m saying<br>Is I, want you<br><br>(2nd Verse; IV Montana)<br>I been, lookin at you since the dance floor<br>She goin, make a rich n**** lose his cash flow<br>How you feel, bout a real, (real) with a job tho<br>No I got no time to waste, so she go cut it to chase<br>I love the way you really, really bout to bust it out<br>Make me feel like I’m the type of n**** you been thinkin bout<br>I just want to beat up in that p**** let me thug it out<br>Swear I go black beattles in that p**** let me rock it out<br>I can tell the way you like it, now I’m gone go pipe it<br>You a bad b**** but I ain’t tryna wife it<br>Gone count them dollazs up (up)<br>You the type of right chick<br>More than just my side chick<br>(Side chick)<br>Type I’ll spend the night with<br>(Hook; Jxhines)<br>Underneath this club lights<br>Baby we can disappear<br>Girl I swear the moves right<br>Let’s just dip up out of here<br>(Yeah)<br>I know, you feel it<br>I know, you do<br>Girl all, I’m saying<br>Is I, want you<br><br>(3rd Verse; Jxhines)<br>(Let the money fall, Let the money fall, Let the money fall)<br>Yeah, all over your skin<br>(A n**** tryna ball, n**** tryna ball, n**** tryna ball)<br>Yeah, gone put a n**** in<br>Let the money fall, Let the money fall, Let the money fall<br>All over your skin<br>A n**** tryna ball, n**** tryna ball, n**** tryna ball<br>Gone put a n**** in<br><br>(Hook; Jxhines)<br>Underneath this club lights<br>Baby we can disappear<br>Girl I swear the moves right<br>Let’s just dip up out of here<br>(Yeah)<br>I know, you feel it<br>I know, you do<br>Girl all, I’m saying<br>Is I, want you",IV Montana,0,,https://i.scdn.co/image/ab6761610000e5eb6dd515f1201da6e63c966416
